{
  "$schema": "https://json-schema.org/draft/2020-12/schema",
  "$id": "https://hermes.local/dfm/topology-map.schema.json",
  "title": "Hermes DFM Topology To Render Mesh Map",
  "type": "object",
  "additionalProperties": false,
  "required": ["schema_version", "map_id", "run_id", "input_sha256", "scene_ref", "topology_snapshot", "render_mesh_snapshot_ref", "faces"],
  "properties": {
    "schema_version": {"const": 2},
    "map_id": {"type": "string", "minLength": 1},
    "run_id": {"type": "string", "minLength": 1},
    "input_sha256": {"type": "string", "pattern": "^[0-9a-f]{64}$"},
    "scene_ref": {"type": "string", "minLength": 1},
    "topology_snapshot": {"$ref": "#/$defs/topologySnapshot"},
    "render_mesh_snapshot_ref": {"type": "string", "minLength": 1},
    "edges": {
      "type": "array", "items": {
        "type": "object", "additionalProperties": false, "required": ["geometry_ref", "adjacent_face_indices"],
        "properties": {
          "geometry_ref": {"allOf": [{"$ref": "https://hermes.local/dfm/geometry/common.schema.json#/$defs/geometryRef"}, {"properties": {"kind": {"const": "edge"}}}]},
          "adjacent_face_indices": {"type": "array", "uniqueItems": true, "items": {"type": "integer", "minimum": 1}}
        }
      }
    },
    "faces": {
      "type": "array",
      "items": {
        "type": "object",
        "additionalProperties": false,
        "required": ["geometry_ref", "triangle_refs"],
        "properties": {
          "geometry_ref": {"$ref": "https://hermes.local/dfm/geometry/common.schema.json#/$defs/faceGeometryRef"},
          "triangle_refs": {"type": "array", "items": {"$ref": "https://hermes.local/dfm/geometry/common.schema.json#/$defs/triangleRef"}}
        }
      }
    }
  },
  "$defs": {
    "topologySnapshot": {
      "type": "object", "additionalProperties": false,
      "required": ["topology_snapshot_id", "input_sha256", "backend", "backend_version", "loader_id", "loader_version", "indexer_id", "indexer_version", "entity_count", "topology_content_sha256"],
      "properties": {
        "topology_snapshot_id": {"type": "string", "minLength": 1},
        "input_sha256": {"type": "string", "pattern": "^[0-9a-f]{64}$"},
        "backend": {"type": "string", "minLength": 1}, "backend_version": {"type": "string", "minLength": 1},
        "loader_id": {"type": "string", "minLength": 1}, "loader_version": {"type": "string", "minLength": 1},
        "indexer_id": {"type": "string", "minLength": 1}, "indexer_version": {"type": "string", "minLength": 1},
        "entity_count": {"type": "object"},
        "topology_content_sha256": {"type": "string", "pattern": "^[0-9a-f]{64}$"}
      }
    }
  }
}

